hashed_national_id,name,district,country,party,symbol_name,birth_date,description
hash_yasser_mohsen_bus_001,Yasser Mohsen,Business District 1 - New Administrative Capital,Egypt,Innovation Hub Party,Gear,1972-02-28T00:00:00Z,Tech startup founder and innovation ecosystem builder
hash_noha_salem_bus_002,Noha Salem,Business District 1 - New Administrative Capital,Egypt,SME Support Alliance,Handshake,1976-10-14T00:00:00Z,Small business consultant and entrepreneurship advocate
hash_mahmoud_adel_bus_003,Mahmoud Adel,Business District 2 - New Cairo,Egypt,Financial Services Coalition,Dollar Sign,1969-04-03T00:00:00Z,Banking executive and financial inclusion expert
hash_aya_mostafa_bus_004,Aya Mostafa,Business District 2 - New Cairo,Egypt,Export Development Movement,Globe,1981-12-20T00:00:00Z,International trade specialist and export promotion expert
hash_karim_farouk_bus_005,Karim Farouk,Business District 3 - Smart Village,Egypt,Digital Economy Party,Network,1984-06-17T00:00:00Z,Software architect and digital transformation consultant
